{
  "ledger_version": "sota_outreach_action_ledger_v1",
  "source_draft_package_version": "sota_outreach_drafts_v1",
  "source_draft_generated_at": "2026-07-09T02:20:00.000Z",
  "generated_at": "2026-07-09T02:21:00.000Z",
  "send_policy": {
    "time_zone": "America/Chicago",
    "allowed_weekdays": [
      "Tuesday",
      "Wednesday",
      "Thursday"
    ],
    "local_send_hour_start": 8,
    "local_send_hour_end": 11,
    "no_blasts": true,
    "max_first_wave_targets": 8,
    "max_per_send_window": 4,
    "send_spacing_minutes": 30,
    "follow_up_business_days": [
      3,
      7
    ]
  },
  "summary": {
    "total": 8,
    "planned": 8,
    "completed": 0,
    "blocked": 0,
    "canceled": 0,
    "recipient_facing": 8,
    "due_now": 0,
    "next_action_at": "2026-07-09T13:00:00.000Z",
    "next_follow_up_at": null
  },
  "actions": [
    {
      "action_id": "baseline-paid-revops-finance-pool__post_paid_baseline_recruiting_task",
      "draft_id": "baseline-paid-revops-finance-pool__paid-practitioner-baseline-short",
      "target_id": "baseline-paid-revops-finance-pool",
      "lane": "paid_practitioner_baseline",
      "priority": "P0",
      "action_type": "post_paid_baseline_recruiting_task",
      "status": "planned",
      "recipient_facing": true,
      "recommended_at": "2026-07-09T13:00:00.000Z",
      "contact_method": "marketplace",
      "contact_value": "Respondent, User Interviews, Prolific, or CloudResearch Connect",
      "message_sha256": "sha256:df5d1727409654f80b0ea84146bc5a6c3d29ea37ddcb63883732fb445cfa70cc",
      "blocked_reasons": [],
      "execution_notes": [
        "Create or post a paid recruiting task through the chosen practitioner pool; this is not a direct-recipient email."
      ],
      "completed_at": null,
      "operator": null,
      "receipt": null,
      "follow_up_schedule": [],
      "notes": null
    },
    {
      "action_id": "baseline-paid-sre-incident-pool__post_paid_baseline_recruiting_task",
      "draft_id": "baseline-paid-sre-incident-pool__paid-practitioner-baseline-short",
      "target_id": "baseline-paid-sre-incident-pool",
      "lane": "paid_practitioner_baseline",
      "priority": "P0",
      "action_type": "post_paid_baseline_recruiting_task",
      "status": "planned",
      "recipient_facing": true,
      "recommended_at": "2026-07-09T13:30:00.000Z",
      "contact_method": "marketplace",
      "contact_value": "Respondent, User Interviews, Prolific, or CloudResearch Connect",
      "message_sha256": "sha256:93aa288f5db828efa7d359456b5d92e2f994d70d895f449c8759892f3c847e79",
      "blocked_reasons": [],
      "execution_notes": [
        "Create or post a paid recruiting task through the chosen practitioner pool; this is not a direct-recipient email."
      ],
      "completed_at": null,
      "operator": null,
      "receipt": null,
      "follow_up_schedule": [],
      "notes": null
    },
    {
      "action_id": "methodology-metr__send_email",
      "draft_id": "methodology-metr__methodology-review-short",
      "target_id": "methodology-metr",
      "lane": "methodology_advisor",
      "priority": "P0",
      "action_type": "send_email",
      "status": "planned",
      "recipient_facing": true,
      "recommended_at": "2026-07-09T14:00:00.000Z",
      "contact_method": "public_email",
      "contact_value": "info@metr.org",
      "message_sha256": "sha256:22ac4c7a55ba4bb01b3fec706bedee10797abc9a1cd5c9b093b1c73e8f40902e",
      "blocked_reasons": [],
      "execution_notes": [],
      "completed_at": null,
      "operator": null,
      "receipt": null,
      "follow_up_schedule": [],
      "notes": null
    },
    {
      "action_id": "methodology-epoch-frontiermath__send_email",
      "draft_id": "methodology-epoch-frontiermath__methodology-review-short",
      "target_id": "methodology-epoch-frontiermath",
      "lane": "methodology_advisor",
      "priority": "P1",
      "action_type": "send_email",
      "status": "planned",
      "recipient_facing": true,
      "recommended_at": "2026-07-09T14:30:00.000Z",
      "contact_method": "public_email",
      "contact_value": "info@epoch.ai",
      "message_sha256": "sha256:d2908b6794de299358cd83180ce6fcb3473bae2f0f37a23f0cc1afe2aec57a8e",
      "blocked_reasons": [],
      "execution_notes": [],
      "completed_at": null,
      "operator": null,
      "receipt": null,
      "follow_up_schedule": [],
      "notes": null
    },
    {
      "action_id": "methodology-swe-bench-authors__send_email",
      "draft_id": "methodology-swe-bench-authors__methodology-review-short",
      "target_id": "methodology-swe-bench-authors",
      "lane": "methodology_advisor",
      "priority": "P0",
      "action_type": "send_email",
      "status": "planned",
      "recipient_facing": true,
      "recommended_at": "2026-07-14T13:00:00.000Z",
      "contact_method": "public_email",
      "contact_value": "carlosej@cs.princeton.edu, johnby@stanford.edu",
      "message_sha256": "sha256:8010799eeb1a8688a09f76301adbbd22e97c98ee6599d2166afea26939290464",
      "blocked_reasons": [],
      "execution_notes": [],
      "completed_at": null,
      "operator": null,
      "receipt": null,
      "follow_up_schedule": [],
      "notes": null
    },
    {
      "action_id": "replication-tau-bench-authors__send_email",
      "draft_id": "replication-tau-bench-authors__replication-partner-short",
      "target_id": "replication-tau-bench-authors",
      "lane": "replication_partner",
      "priority": "P0",
      "action_type": "send_email",
      "status": "planned",
      "recipient_facing": true,
      "recommended_at": "2026-07-14T13:30:00.000Z",
      "contact_method": "public_email",
      "contact_value": "research@sierra.ai",
      "message_sha256": "sha256:e69e24a68ea9924e6fd2c70b8ad6c20ba01f3a75306eab19bb78df52a413a5d7",
      "blocked_reasons": [],
      "execution_notes": [],
      "completed_at": null,
      "operator": null,
      "receipt": null,
      "follow_up_schedule": [],
      "notes": null
    },
    {
      "action_id": "replication-webarena-agentcompany__send_email",
      "draft_id": "replication-webarena-agentcompany__replication-partner-short",
      "target_id": "replication-webarena-agentcompany",
      "lane": "replication_partner",
      "priority": "P0",
      "action_type": "send_email",
      "status": "planned",
      "recipient_facing": true,
      "recommended_at": "2026-07-14T14:00:00.000Z",
      "contact_method": "public_email",
      "contact_value": "fangzhex@cs.cmu.edu, yufans@alumni.cmu.edu, boxuanli@alumni.cmu.edu",
      "message_sha256": "sha256:6a83571e9fd841b3af57fcb6feb96bb488577d1ba2a3c940af63188c7ea67bc6",
      "blocked_reasons": [],
      "execution_notes": [],
      "completed_at": null,
      "operator": null,
      "receipt": null,
      "follow_up_schedule": [],
      "notes": null
    },
    {
      "action_id": "reproduction-independent-engineer__request_warm_intro",
      "draft_id": "reproduction-independent-engineer__stranger-reproduction-short",
      "target_id": "reproduction-independent-engineer",
      "lane": "stranger_reproduction_reviewer",
      "priority": "P0",
      "action_type": "request_warm_intro",
      "status": "planned",
      "recipient_facing": true,
      "recommended_at": "2026-07-14T14:30:00.000Z",
      "contact_method": "warm_intro_needed",
      "contact_value": null,
      "message_sha256": "sha256:861adc675ec389aceb40323ed985339405945d9228d28fa990151614dffb7855",
      "blocked_reasons": [],
      "execution_notes": [
        "Ask a trusted introducer first; send direct copy only after the target opts into the thread."
      ],
      "completed_at": null,
      "operator": null,
      "receipt": null,
      "follow_up_schedule": [],
      "notes": null
    }
  ]
}
